{
  "clickmap_version": 1,
  "window": {
    "width": 320,
    "height": 480
  },
  "defaults": {
    "press_ms": 150,
    "settle_ms": 5000
  },
  "steps": [
    {
      "id": "boot",
      "action": "wait",
      "settle_ms": 25000
    },
    {
      "id": "sound",
      "action": "tap",
      "at": [
        224,
        375
      ],
      "settle_ms": 5000
    },
    {
      "id": "play",
      "action": "tap",
      "at": [
        160,
        183
      ],
      "settle_ms": 7000
    },
    {
      "id": "drag-right",
      "action": "swipe",
      "duration_ms": 4000,
      "settle_ms": 5000,
      "from_xy": [
        160,
        410
      ],
      "to_xy": [
        260,
        410
      ]
    },
    {
      "id": "drag-left",
      "action": "swipe",
      "duration_ms": 4000,
      "settle_ms": 10000,
      "from_xy": [
        260,
        410
      ],
      "to_xy": [
        80,
        410
      ]
    }
  ],
  "app": {
    "bundle_identifier": "com.eeenmachine.scoops",
    "display_name": "Scoops",
    "version": "2.5.1",
    "sha256": "3d4ce40592e352da6bbfdd894deac870183cd633a2f9b54c1adc70a8788dc45e"
  },
  "recorded": {
    "date": "2026-09-23",
    "host": "iOS 18.5 Intel Simulator, Apple Software Renderer",
    "by": "OpenAI Codex"
  },
  "milestone": {
    "rating": 3,
    "describes": "The scoop stack grows and the score changes during gameplay."
  },
  "notes": [
    "Observed on an uncommitted development build with explicit --replay-scale-to-viewport. This route is not a published compatibility rating; other hosts must verify it independently."
  ]
}
