{
  "clickmap_version": 1,
  "app": {
    "bundle_identifier": "com.Pickl.Crafted",
    "display_name": "Crafted",
    "version": "1.0.1",
    "sha256": "940c90748b520cd6bf7dbfbf8da33d15b0e6b151a71875ed6358e344a9e82352"
  },
  "recorded": {
    "date": "2026-09-23",
    "host": "iOS 18.5 Intel Simulator, Apple Software Renderer",
    "by": "OpenAI Codex"
  },
  "options": [
    "--landscape-left"
  ],
  "window": {
    "width": 480,
    "height": 320,
    "orientation": "landscape-left"
  },
  "milestone": {
    "rating": 3,
    "describes": "A world has been generated and is being played: the player stands on terrain with trees and animals, the health bar and hotbar are drawn, the touch controls are on screen, and the scene stays live for as long as it is watched."
  },
  "defaults": {
    "press_ms": 150,
    "settle_ms": 8000
  },
  "steps": [
    {
      "id": "boot",
      "action": "wait",
      "settle_ms": 90000,
      "expect": "The main menu: the CRAFTED logo over Singleplayer / Options... / How to play..."
    },
    {
      "id": "singleplayer",
      "from": "main menu",
      "action": "tap",
      "at": [
        240,
        154
      ],
      "expect": "The Select World screen. On a fresh profile the world list is empty and Play Selected World, Rename and Delete are all greyed out; with a world saved it is listed with its name, date and size."
    },
    {
      "id": "create",
      "from": "Select World",
      "action": "tap",
      "at": [
        366,
        247
      ],
      "expect": "The world creation form: World Name prefilled with \"New World\", an empty seed box, and its own Create New World button.",
      "requires_save_state": "absent"
    },
    {
      "id": "confirm",
      "from": "the world creation form",
      "action": "tap",
      "at": [
        240,
        247
      ],
      "settle_ms": 40000,
      "expect": "The world generates and gameplay starts: the player on grass and dirt with trees, pigs wandering, ten hearts along the top, the hotbar along the bottom and the four touch controls.",
      "requires_save_state": "absent"
    },
    {
      "id": "select-row",
      "from": "Select World",
      "action": "tap",
      "at": [
        80,
        88
      ],
      "settle_ms": 4000,
      "requires_save_state": "present",
      "expect": "The saved world's row is selected, and Play Selected World, Rename and Delete stop being greyed out."
    },
    {
      "id": "play-saved",
      "from": "Select World",
      "action": "tap",
      "at": [
        114,
        244
      ],
      "settle_ms": 40000,
      "requires_save_state": "present",
      "expect": "The saved world loads and gameplay resumes in it \u2014 the terrain it was left on, not a newly generated world."
    },
    {
      "id": "persist",
      "from": "gameplay",
      "action": "wait",
      "settle_ms": 30000,
      "expect": "The world is still there and still animating half a minute later - the pigs wander, the health bar and hotbar stay drawn, and nothing panics. That persistence is the second half of the milestone."
    }
  ],
  "notes": [
    "Coordinates are client coordinates for the 480x320 landscape window.",
    "**`--landscape-left` is part of the route**, and it is already set for this bundle in tapHLE_default_options.txt. The app declares no orientation at all in its Info.plist, and tapHLE only consults `shouldAutorotateToInterfaceOrientation:` when the window is already non-portrait \u2014 so nothing ever asks this app which way up it wants to be. Launched portrait it draws its 480-wide layout into a 320-wide screen and the splash is visibly cut off. That gap is general, not specific to this app, and fixing it is separate work.",
    "There are two buttons labelled Create New World, one after the other: (366, 247) on the Select World screen opens the form, and (240, 247) on the form actually creates it. Missing the second one leaves the replay sitting on a form that looks like it should have worked.",
    "The world name and seed are left at their defaults \u2014 \"New World\" and a random seed \u2014 so no typing is needed. The world is written to `Documents/saves/New World/`.",
    "**The route forks on whether a world is already saved, and the runner cannot tell** \u2014 pass -HasSaveState once one exists. Without it the two creation taps run; with it the Select World row is picked and played instead, which is what a player does on every launch after the first. Both halves were replayed on `63119bcf`. Two tapHLE bugs used to make the saved-world half impossible: `Fs::size()` panicked on a directory, and `NSMutableString` had no `replaceCharactersInRange:withString:` to build the row's label; both were fixed on 2026-08-19.",
    "The scene animates on its own: the pigs wander whether or not any input arrived. So two frames differing is not evidence a control worked \u2014 compare the region the player is in against a region nothing should have touched.",
    "**Movement is not on this route, and that is a property of the game rather than a gap in the map.** The two controls down the left are build controls - place a block below, place a block ahead - and with an empty hotbar they correctly do nothing: holding the lower one for 2.5 s moved the view no more than the pigs move it on their own (measured, 1.2 against an ambient 1.2-1.7 mean absolute difference). This app declares `accelerometer` as a required capability and steers by tilt, which in tapHLE is the right mouse button held while the cursor moves, and a clickmap has no way to express that. So the milestone here rests on the world generating and staying live, not on driving the player around.",
    "The Play Selected World coordinate is a client coordinate, and the capture is of the whole window: reading the button's position straight off a frame lands about (8, 31) low, in the gap between the two button rows, where the tap does nothing and the screen does not change.",
    "Observed on an uncommitted development build with explicit --replay-scale-to-viewport. This route is not a published compatibility rating; other hosts must verify it independently."
  ]
}
